{
  "mappings_version": "1.0.0",
  "description": "Test mappings",
  "taxonomy_reference": "v3/brain/01_research_and_lenses/librarian/RESEARCH_TAXONOMY.md",
  "rules": [
    {
      "legacy_topic": "heuristics_biases",
      "direction": "legacy_to_canonical",
      "applied_in": [
        "SRC-TEST-2026"
      ],
      "mappings": [
        {
          "canonical_target": "decision_making",
          "relation_type": "broader_term"
        }
      ],
      "rationale": "Regla accepted con fecha pero sin humano.",
      "review_status": "accepted",
      "approved_by_humans": [],
      "approval_date": "2026-09-10"
    }
  ]
}